{
 "schema": "visitflow/model",
 "version": "1.0",
 "problem_hash": "sha256:82725b2f9b68d1ce7bb8f1bc0460e71057fcaf4ee24fa5efebb23e830d661121",
 "formulation": {
  "kind": "fixed-row-v2",
  "vars": {
   "y_pairs": 4048
  }
 },
 "legal_domain": {
  "pairs_total": 4048,
  "pairs_legal": 4048,
  "fixed": 0
 },
 "feasibility_precheck": {
  "capacity_ok": true,
  "contract_ok": true,
  "corridor_ok": true
 },
 "meta": {
  "compile_ms": 0,
  "ambiguous_stores": 0
 }
}